{
  "schema_version": "aon-taxonomy-definition-v1",
  "taxonomy_version": "v1",
  "definition_status": "defined",
  "publication_binding": "committed_protocol_release",
  "baseline_node_count": 515,
  "added_definition_count": 1221,
  "node_count": 1736,
  "added_category_ids": [
    "ai_software_services",
    "ai_software_services.ai_assistant",
    "ai_software_services.ai_assistant.ai_agents",
    "ai_software_services.ai_assistant.ai_search_research",
    "ai_software_services.ai_assistant.general_personal_assistants",
    "ai_software_services.ai_business_productivity",
    "ai_software_services.ai_business_productivity.crm_marketing",
    "ai_software_services.ai_business_productivity.customer_support",
    "ai_software_services.ai_business_productivity.ecommerce_pos",
    "ai_software_services.ai_business_productivity.file_storage_sharing",
    "ai_software_services.ai_business_productivity.finance_accounting",
    "ai_software_services.ai_business_productivity.hr_payroll",
    "ai_software_services.ai_business_productivity.industry_systems",
    "ai_software_services.ai_business_productivity.meetings_collaboration",
    "ai_software_services.ai_business_productivity.office_docs_notes",
    "ai_software_services.ai_business_productivity.project_automation",
    "ai_software_services.ai_business_productivity.writing_translation",
    "ai_software_services.ai_coding_dev",
    "ai_software_services.ai_coding_dev.ai_coding_assistants",
    "ai_software_services.ai_coding_dev.dev_tools_ides",
    "ai_software_services.ai_coding_dev.website_app_builders",
    "ai_software_services.ai_creative_software",
    "ai_software_services.ai_creative_software.audio_voice_music",
    "ai_software_services.ai_creative_software.design_graphics",
    "ai_software_services.ai_creative_software.image_photo",
    "ai_software_services.ai_creative_software.modeling_3d_cad",
    "ai_software_services.ai_creative_software.stock_media_assets",
    "ai_software_services.ai_creative_software.video_creation",
    "ai_software_services.developer_cloud_infra",
    "ai_software_services.developer_cloud_infra.ai_model_apis",
    "ai_software_services.developer_cloud_infra.cloud_compute_gpu",
    "ai_software_services.developer_cloud_infra.communication_apis",
    "ai_software_services.developer_cloud_infra.databases_object_storage",
    "ai_software_services.developer_cloud_infra.hosting_domains_cdn",
    "ai_software_services.developer_cloud_infra.proxies_scraping",
    "ai_software_services.utility_security_software",
    "ai_software_services.utility_security_software.everyday_utilities",
    "ai_software_services.utility_security_software.security_privacy",
    "arts_entertainment.creator_memberships",
    "arts_entertainment.movies_films.film_video_media",
    "arts_entertainment.music_audio.music_streaming_services",
    "arts_entertainment.music_audio.musical_instruments",
    "arts_entertainment.music_audio.musical_instruments.musical_instrument_accessories",
    "arts_entertainment.music_audio.podcast_content",
    "arts_entertainment.music_audio.recorded_music",
    "arts_entertainment.tv_video.film_tv_streaming_services",
    "automotive.vehicle_parts_accessories.automotive_batteries",
    "automotive.vehicle_parts_accessories.automotive_lighting_electrical_parts",
    "automotive.vehicle_parts_accessories.automotive_oils_fluids",
    "automotive.vehicle_parts_accessories.brake_parts",
    "automotive.vehicle_parts_accessories.cooling_climate_control_parts",
    "automotive.vehicle_parts_accessories.electric_vehicle_charging_equipment",
    "automotive.vehicle_parts_accessories.emergency_roadside_equipment",
    "automotive.vehicle_parts_accessories.engine_powertrain_parts",
    "automotive.vehicle_parts_accessories.exhaust_emissions_parts",
    "automotive.vehicle_parts_accessories.routine_maintenance_parts",
    "automotive.vehicle_parts_accessories.steering_suspension_parts",
    "automotive.vehicle_parts_accessories.towing_cargo_trailer_accessories",
    "automotive.vehicle_parts_accessories.vehicle_exterior_accessories",
    "automotive.vehicle_parts_accessories.vehicle_interior_accessories",
    "automotive.vehicle_parts_accessories.vehicle_maintenance_detailing_supplies",
    "beauty_personal_care.hair_care.hair_color",
    "beauty_personal_care.hair_care.hair_styling_products",
    "beauty_personal_care.hair_care.hair_treatments_masks",
    "beauty_personal_care.hygiene_toiletries.bath_products",
    "beauty_personal_care.make_up_cosmetics.eye_brow_makeup",
    "beauty_personal_care.make_up_cosmetics.face_makeup",
    "beauty_personal_care.make_up_cosmetics.lip_makeup",
    "beauty_personal_care.make_up_cosmetics.makeup_brushes_applicators",
    "beauty_personal_care.make_up_cosmetics.nail_cosmetics",
    "beauty_personal_care.oral_care.dental_floss_interdental_care",
    "beauty_personal_care.oral_care.mouthwash_breath_care",
    "beauty_personal_care.oral_care.toothbrushes",
    "beauty_personal_care.oral_care.toothpaste",
    "beauty_personal_care.personal_care_appliances",
    "beauty_personal_care.personal_care_appliances.beauty_skin_care_devices",
    "beauty_personal_care.personal_care_appliances.hair_dryers",
    "beauty_personal_care.personal_care_appliances.hair_removal_devices",
    "beauty_personal_care.personal_care_appliances.hair_styling_appliances",
    "beauty_personal_care.shaving_grooming.electric_shavers_trimmers",
    "beauty_personal_care.shaving_grooming.razors_replacement_blades",
    "beauty_personal_care.shaving_grooming.shaving_preparations",
    "beauty_personal_care.skin_care.body_exfoliants",
    "beauty_personal_care.skin_care.body_moisturizers",
    "beauty_personal_care.skin_care.face_care.face_cleansers",
    "beauty_personal_care.skin_care.face_care.face_masks",
    "beauty_personal_care.skin_care.face_care.facial_moisturizers",
    "beauty_personal_care.skin_care.face_care.facial_serums_treatments",
    "beauty_personal_care.skin_care.face_care.facial_toners_mists",
    "beauty_personal_care.skin_care.face_care.lip_care",
    "business_industrial.building_construction_maintenance.hardware_tools_accessories.fasteners_fittings_mounts",
    "business_industrial.building_construction_maintenance.hardware_tools_accessories.hand_tools",
    "business_industrial.building_construction_maintenance.hardware_tools_accessories.measuring_marking_tools",
    "business_industrial.building_construction_maintenance.hardware_tools_accessories.safety_protective_equipment",
    "business_industrial.office.office_paper_products",
    "business_industrial.office.printer_consumables_supplies",
    "business_industrial.office.writing_drawing_supplies",
    "computers_electronics.computers.computer_accessories.computer_connectivity_hubs",
    "computers_electronics.computers.computer_accessories.computer_keyboards",
    "computers_electronics.computers.computer_accessories.computer_mice",
    "computers_electronics.computers.computer_accessories.docking_stations",
    "computers_electronics.computers.computer_accessories.webcams",
    "computers_electronics.computers.computer_systems_hardware.computer_components",
    "computers_electronics.computers.computer_systems_hardware.computer_components.computer_cases",
    "computers_electronics.computers.computer_systems_hardware.computer_components.computer_cooling_components",
    "computers_electronics.computers.computer_systems_hardware.computer_components.computer_memory",
    "computers_electronics.computers.computer_systems_hardware.computer_components.computer_power_supplies",
    "computers_electronics.computers.computer_systems_hardware.computer_components.computer_processors",
    "computers_electronics.computers.computer_systems_hardware.computer_components.graphics_cards",
    "computers_electronics.computers.computer_systems_hardware.computer_components.motherboards",
    "computers_electronics.computers.computer_systems_hardware.computer_monitors",
    "computers_electronics.computers.computer_systems_hardware.data_storage_devices",
    "computers_electronics.computers.computer_systems_hardware.data_storage_devices.external_storage_drives",
    "computers_electronics.computers.computer_systems_hardware.data_storage_devices.internal_storage_drives",
    "computers_electronics.computers.computer_systems_hardware.data_storage_devices.memory_cards",
    "computers_electronics.computers.computer_systems_hardware.data_storage_devices.network_attached_storage_devices",
    "computers_electronics.computers.computer_systems_hardware.data_storage_devices.usb_flash_drives",
    "computers_electronics.computers.computer_systems_hardware.desktop_computers",
    "computers_electronics.computers.computer_systems_hardware.printers_scanners",
    "computers_electronics.computers.computer_systems_hardware.printers_scanners.printers",
    "computers_electronics.computers.computer_systems_hardware.printers_scanners.scanners",
    "computers_electronics.computers.computer_systems_hardware.tablet_computers",
    "computers_electronics.computers.software.business_productivity_software.writing_assistance_software",
    "computers_electronics.computers.software.graphics_multimedia_software.video_creation_editing_software",
    "computers_electronics.computers.software.internet_software_web_apps.website_builder_software",
    "computers_electronics.computers.software.machine_learning_model_artifacts",
    "computers_electronics.consumer_electronics.car_audio_video.dash_cameras",
    "computers_electronics.consumer_electronics.consumer_electronic_accessories.device_cases_protectors",
    "computers_electronics.consumer_electronics.consumer_electronic_accessories.device_chargers_power_adapters",
    "computers_electronics.consumer_electronics.consumer_electronic_accessories.device_data_charging_cables",
    "computers_electronics.consumer_electronics.consumer_electronic_accessories.mobile_device_mounts_stands",